{"hostCapabilities":{"captureSource":"native Codex control-plane metadata plus local CLI evidence","capturedAt":"2026-09-01T12:00:00Z","cliEvidenceDigest":"sha256:aaaaaaaaaaaaaaaaaaaaaaaaaaaaaaaaaaaaaaaaaaaaaaaaaaaaaaaaaaaaaaaa","codexVersion":"codex-cli 1.2.3","gitEvidenceDigest":"sha256:bbbbbbbbbbbbbbbbbbbbbbbbbbbbbbbbbbbbbbbbbbbbbbbbbbbbbbbbbbbbbbbb","gitVersion":"git version 2.51.0.windows.1","hostConcurrencyCeiling":2,"os":"Windows 11","pythonVersion":"3.11.9","reasoningConfig":{"evidenceDigest":"sha256:cccccccccccccccccccccccccccccccccccccccccccccccccccccccccccccccc","key":"model_reasoning_effort"},"schemaVersion":"compass-builder.host-capabilities.v1","selectedModel":"gpt-5.6-sol","supportedEfforts":["low","medium","high","xhigh"],"supports":{"multiAgentDisable":true,"structuredOutput":true,"workingDirectoryBinding":true,"worktrees":true},"userConcurrencyCeiling":2,"validUntil":"2026-09-01T12:05:00Z"},"pipelinePlan":{"baseSha":"aaaaaaaaaaaaaaaaaaaaaaaaaaaaaaaaaaaaaaaa","concurrency":2,"dispatchStrategy":"rolling","effortPolicyVersion":"speed.v1","executionMode":"parallel","gatePolicyDigest":"sha256:4444444444444444444444444444444444444444444444444444444444444444","hostEvidenceDigest":"sha256:c3d16f30ece5a5fa4a9f7f6c3c703102e9aac21e0f97cae0094436c6db0c750b","initialReadyStoryIds":["alpha"],"integrationBranch":"cb/rolling/integration","integrationExpectedSha":"aaaaaaaaaaaaaaaaaaaaaaaaaaaaaaaaaaaaaaaa","normalizedInputDigest":"sha256:354c80c467d79e8357bb479c259fd07f9224a54e221c138ae447876372ac243e","reasons":["Rolling is explicitly authorized for the v2 contract fixture."],"runId":"cb-rolling-1111111111111111","schedulingPolicyDigest":"sha256:3333333333333333333333333333333333333333333333333333333333333333","schemaVersion":"compass-builder.pipeline-plan.v2","stories":[{"branch":"cb/cb-rolling-1111111111111111/alpha","dependsOn":[],"handoffDigest":"sha256:5555555555555555555555555555555555555555555555555555555555555555","integrationOrdinal":1,"recommendedEffort":"high","requiredOutcomeGateIds":["gate-alpha"],"specificationOrder":0,"storyId":"alpha","writeScopes":["src/alpha"]},{"branch":"cb/cb-rolling-1111111111111111/beta","dependsOn":["alpha"],"handoffDigest":"sha256:6666666666666666666666666666666666666666666666666666666666666666","integrationOrdinal":2,"recommendedEffort":"medium","requiredOutcomeGateIds":["gate-beta"],"specificationOrder":1,"storyId":"beta","writeScopes":["src/beta"]}]},"planningTimestamp":"2026-09-01T12:01:00Z","runSpec":{"baseRef":"main","baseSha":"aaaaaaaaaaaaaaaaaaaaaaaaaaaaaaaaaaaaaaaa","calibratedConcurrencyCeiling":2,"dispatchStrategy":"rolling","effortPolicyVersion":"speed.v1","exactModel":"gpt-5.6-sol","executionMode":"parallel","experimentalRollingAuthorized":true,"hostConcurrencyCeiling":2,"integrationBranch":"cb/rolling/integration","integrationExpectedSha":"aaaaaaaaaaaaaaaaaaaaaaaaaaaaaaaaaaaaaaaa","runId":"cb-rolling-1111111111111111","schemaVersion":"compass-builder.run-spec.v2","stories":[{"acceptanceChecks":["alpha contract is green"],"ambiguity":"low","completionState":"pending","complexity":"medium","dependsOn":[],"description":"Create the first closed rolling contract.","id":"alpha","independentReviewPath":null,"priority":10,"requiredOutcomeGateIds":["gate-alpha"],"risk":"medium","sharedState":{"description":"No shared mutable state.","mode":"none"},"title":"Alpha contract","validationCommands":["python -m unittest tests.test_builder_rolling_models"],"validationStrength":"decisive","writeScopes":["src/alpha"]},{"acceptanceChecks":["beta binding is green"],"ambiguity":"low","completionState":"pending","complexity":"medium","dependsOn":["alpha"],"description":"Bind a dependent rolling contract.","id":"beta","independentReviewPath":null,"priority":5,"requiredOutcomeGateIds":["gate-beta"],"risk":"medium","sharedState":{"description":"Reads alpha output without mutation.","mode":"read-only"},"title":"Beta contract","validationCommands":["python -m unittest tests.test_builder_rolling_models"],"validationStrength":"decisive","writeScopes":["src/beta"]}],"userConcurrencyCeiling":2,"validationCommands":["python -m unittest tests.test_builder_rolling_models tests.test_builder_models"]},"schemaVersion":"compass-builder.execution-bundle.v2"}
